{
  "tarea_id": "2026-10-pagar-trasladar-o-esperar-v5",
  "svg": "<svg xmlns=\"http://www.w3.org/2000/svg\" viewBox=\"0 0 400 300\" width=\"400\" height=\"300\"><title>Queso y balanza de justicia sobre fondo claro</title><rect x=\"0\" y=\"0\" width=\"400\" height=\"300\" fill=\"#fef3c7\"/><rect x=\"40\" y=\"200\" width=\"140\" height=\"50\" rx=\"6\" fill=\"#b45309\"/><polygon points=\"40,200 180,200 150,140 70,140\" fill=\"#f59e0b\"/><circle cx=\"100\" cy=\"172\" r=\"9\" fill=\"#fde68a\"/><circle cx=\"140\" cy=\"186\" r=\"6\" fill=\"#fde68a\"/><rect x=\"294\" y=\"90\" width=\"12\" height=\"150\" fill=\"#374151\"/><rect x=\"260\" y=\"236\" width=\"80\" height=\"16\" rx=\"4\" fill=\"#1f2937\"/><line x1=\"240\" y1=\"100\" x2=\"360\" y2=\"100\" stroke=\"#374151\" stroke-width=\"8\" stroke-linecap=\"round\"/><path d=\"M215 160 Q240 190 265 160 Z\" fill=\"#7c3aed\"/><path d=\"M335 160 Q360 190 385 160 Z\" fill=\"#7c3aed\"/></svg>",
  "foto_descripcion": "Ícono plano de un bloque de queso amarillo con agujeros junto a una balanza gris con dos platillos morados, sobre fondo crema.",
  "paleta_usada": [
    "#1f2937",
    "#374151",
    "#7c3aed",
    "#b45309",
    "#f59e0b",
    "#fde68a",
    "#fef3c7"
  ],
  "viewBox": "0 0 400 300",
  "bytes": 777,
  "meta": {
    "agente": "ilustrador",
    "modelo": "claude-sonnet-5-5",
    "version_prompt": "1.0",
    "fecha": "2026-10-20T23:17:08+00:00",
    "costo_usd": 0.010998,
    "intentos_reparacion": 0
  }
}
