{
  "tarea_id": "2026-10-pagar-trasladar-o-esperar-v4",
  "svg": "<svg xmlns=\"http://www.w3.org/2000/svg\" viewBox=\"0 0 400 300\" width=\"400\" height=\"300\"><title>Queso y balanza de justicia sobre fondo claro</title><rect x=\"0\" y=\"0\" width=\"400\" height=\"300\" fill=\"#fef3c7\"/><polygon points=\"60,200 160,160 160,215 60,250\" fill=\"#f59e0b\"/><polygon points=\"60,200 160,160 200,185 100,225\" fill=\"#fde68a\"/><polygon points=\"100,225 200,185 200,240 100,270\" fill=\"#d97706\"/><circle cx=\"120\" cy=\"215\" r=\"7\" fill=\"#b45309\"/><circle cx=\"165\" cy=\"205\" r=\"5\" fill=\"#92400e\"/><rect x=\"294\" y=\"90\" width=\"12\" height=\"150\" fill=\"#374151\"/><rect x=\"260\" y=\"240\" width=\"80\" height=\"14\" rx=\"4\" fill=\"#1f2937\"/><line x1=\"240\" y1=\"100\" x2=\"360\" y2=\"100\" stroke=\"#374151\" stroke-width=\"8\" stroke-linecap=\"round\"/><path d=\"M215 165 Q250 205 285 165 Z\" fill=\"#7c3aed\"/><path d=\"M315 165 Q350 205 385 165 Z\" fill=\"#7c3aed\"/></svg>",
  "foto_descripcion": "Ícono plano de un bloque de queso amarillo y anaranjado a la izquierda y, a la derecha, una balanza de justicia gris con dos platillos morados sobre fondo crema.",
  "paleta_usada": [
    "#1f2937",
    "#374151",
    "#7c3aed",
    "#92400e",
    "#b45309",
    "#d97706",
    "#f59e0b",
    "#fde68a",
    "#fef3c7"
  ],
  "viewBox": "0 0 400 300",
  "bytes": 840,
  "meta": {
    "agente": "ilustrador",
    "modelo": "claude-sonnet-5-5",
    "version_prompt": "1.0",
    "fecha": "2026-10-20T22:27:22+00:00",
    "costo_usd": 0.011368,
    "intentos_reparacion": 0
  }
}
