{
  "tarea_id": "2026-10-cuanto-pagar-cada-mes-v2",
  "svg": "<svg xmlns=\"http://www.w3.org/2000/svg\" viewBox=\"0 0 400 300\" width=\"400\" height=\"300\"><title>Calendario con casillas y una alcancía con monedas</title><rect x=\"0\" y=\"0\" width=\"400\" height=\"300\" fill=\"#fef3c7\"/><rect x=\"40\" y=\"60\" width=\"160\" height=\"180\" rx=\"12\" fill=\"#ffffff\"/><rect x=\"40\" y=\"60\" width=\"160\" height=\"40\" rx=\"12\" fill=\"#7c3aed\"/><rect x=\"60\" y=\"120\" width=\"30\" height=\"26\" rx=\"4\" fill=\"#c4b5fd\"/><rect x=\"105\" y=\"120\" width=\"30\" height=\"26\" rx=\"4\" fill=\"#c4b5fd\"/><rect x=\"150\" y=\"120\" width=\"30\" height=\"26\" rx=\"4\" fill=\"#c4b5fd\"/><rect x=\"60\" y=\"160\" width=\"30\" height=\"26\" rx=\"4\" fill=\"#c4b5fd\"/><rect x=\"105\" y=\"160\" width=\"30\" height=\"26\" rx=\"4\" fill=\"#c4b5fd\"/><rect x=\"150\" y=\"160\" width=\"30\" height=\"26\" rx=\"4\" fill=\"#c4b5fd\"/><rect x=\"60\" y=\"200\" width=\"30\" height=\"26\" rx=\"4\" fill=\"#c4b5fd\"/><ellipse cx=\"302\" cy=\"198\" rx=\"62\" ry=\"48\" fill=\"#f97316\"/><polygon points=\"262,165 272,140 288,160\" fill=\"#ea580c\"/><rect x=\"270\" y=\"232\" width=\"16\" height=\"22\" rx=\"4\" fill=\"#c2410c\"/><rect x=\"318\" y=\"232\" width=\"16\" height=\"22\" rx=\"4\" fill=\"#c2410c\"/><rect x=\"292\" y=\"152\" width=\"32\" height=\"6\" rx=\"3\" fill=\"#92400e\"/><circle cx=\"280\" cy=\"190\" r=\"5\" fill=\"#111827\"/><circle cx=\"308\" cy=\"96\" r=\"20\" fill=\"#f59e0b\"/></svg>",
  "foto_descripcion": "Ícono plano de un calendario blanco con encabezado violeta y casillas lilas, junto a una alcancía naranja con una moneda dorada encima sobre fondo amarillo claro.",
  "paleta_usada": [
    "#111827",
    "#7c3aed",
    "#92400e",
    "#c2410c",
    "#c4b5fd",
    "#ea580c",
    "#f59e0b",
    "#f97316",
    "#fef3c7",
    "#ffffff"
  ],
  "viewBox": "0 0 400 300",
  "bytes": 1244,
  "meta": {
    "agente": "ilustrador",
    "modelo": "claude-sonnet-5-5",
    "version_prompt": "1.0",
    "fecha": "2026-10-26T19:28:06+00:00",
    "costo_usd": 0.014918,
    "intentos_reparacion": 0
  }
}
