{
  "tarea_id": "2026-10-pagar-trasladar-o-esperar",
  "svg": "<svg xmlns=\"http://www.w3.org/2000/svg\" viewBox=\"0 0 400 300\" width=\"400\" height=\"300\"><title>Caja de queso junto a una balanza de justicia</title><rect x=\"0\" y=\"0\" width=\"400\" height=\"300\" fill=\"#fef3c7\"/><rect x=\"40\" y=\"170\" width=\"130\" height=\"80\" rx=\"8\" fill=\"#b45309\"/><polygon points=\"40,170 105,110 170,170\" fill=\"#f59e0b\"/><circle cx=\"90\" cy=\"195\" r=\"10\" fill=\"#fde68a\"/><circle cx=\"135\" cy=\"215\" r=\"8\" fill=\"#fde68a\"/><rect x=\"290\" y=\"90\" width=\"10\" height=\"150\" fill=\"#374151\"/><rect x=\"250\" y=\"235\" width=\"90\" height=\"14\" rx=\"4\" fill=\"#1f2937\"/><line x1=\"235\" y1=\"100\" x2=\"355\" y2=\"100\" stroke=\"#374151\" stroke-width=\"8\" stroke-linecap=\"round\"/><path d=\"M215 160 Q245 190 275 160 Z\" fill=\"#3b82f6\"/><path d=\"M315 160 Q345 190 375 160 Z\" fill=\"#3b82f6\"/></svg>",
  "foto_descripcion": "Ícono plano de una caja de queso en tonos naranja y amarillo a la izquierda, y una balanza de justicia gris con dos platillos azules a la derecha, sobre fondo crema.",
  "paleta_usada": [
    "#1f2937",
    "#374151",
    "#3b82f6",
    "#b45309",
    "#f59e0b",
    "#fde68a",
    "#fef3c7"
  ],
  "viewBox": "0 0 400 300",
  "bytes": 770,
  "meta": {
    "agente": "ilustrador",
    "modelo": "claude-sonnet-5-5",
    "version_prompt": "1.0",
    "fecha": "2026-10-20T21:22:21+00:00",
    "costo_usd": 0.01105,
    "intentos_reparacion": 0
  }
}
