{
  "tarea_id": "2026-10-viaje-barco-ida-vuelta-v2",
  "svg": "<svg xmlns=\"http://www.w3.org/2000/svg\" viewBox=\"0 0 400 300\" width=\"400\" height=\"300\"><title>Barco de apoyo entre la costa y una plataforma en el mar</title><rect x=\"0\" y=\"0\" width=\"400\" height=\"300\" fill=\"#e0f2fe\"/><rect x=\"0\" y=\"180\" width=\"400\" height=\"120\" fill=\"#60a5fa\"/><path d=\"M0 180 L0 150 Q40 130 90 160 L110 180 Z\" fill=\"#d97706\"/><rect x=\"280\" y=\"110\" width=\"70\" height=\"12\" fill=\"#374151\"/><line x1=\"290\" y1=\"122\" x2=\"290\" y2=\"195\" stroke=\"#4b5563\" stroke-width=\"6\"/><line x1=\"340\" y1=\"122\" x2=\"340\" y2=\"195\" stroke=\"#4b5563\" stroke-width=\"6\"/><rect x=\"300\" y=\"88\" width=\"22\" height=\"22\" fill=\"#ef4444\"/><polygon points=\"150,200 250,200 235,230 165,230\" fill=\"#1e3a8a\"/><rect x=\"185\" y=\"175\" width=\"30\" height=\"25\" fill=\"#ffffff\"/><rect x=\"220\" y=\"185\" width=\"20\" height=\"15\" fill=\"#f97316\"/></svg>",
  "foto_descripcion": "Ícono plano de un barco azul oscuro con cabina blanca sobre el mar azul, con una costa naranja a la izquierda y una plataforma gris con una caseta roja a la derecha.",
  "paleta_usada": [
    "#1e3a8a",
    "#374151",
    "#4b5563",
    "#60a5fa",
    "#d97706",
    "#e0f2fe",
    "#ef4444",
    "#f97316",
    "#ffffff"
  ],
  "viewBox": "0 0 400 300",
  "bytes": 813,
  "meta": {
    "agente": "ilustrador",
    "modelo": "claude-sonnet-5-5",
    "version_prompt": "1.0",
    "fecha": "2026-10-20T22:06:46+00:00",
    "costo_usd": 0.011158,
    "intentos_reparacion": 0
  }
}
