{
  "tarea_id": "2026-10-anticipo-renta-vitalicia-v7",
  "svg": "<svg xmlns=\"http://www.w3.org/2000/svg\" viewBox=\"0 0 400 300\" width=\"400\" height=\"300\"><title>Persona mayor con libreta junto a una balanza con monedas</title><rect x=\"0\" y=\"0\" width=\"400\" height=\"300\" fill=\"#ede9fe\"/><circle cx=\"110\" cy=\"100\" r=\"30\" fill=\"#fde68a\"/><path d=\"M70 230 L70 170 Q110 140 150 170 L150 230 Z\" fill=\"#7c3aed\"/><rect x=\"120\" y=\"185\" width=\"40\" height=\"30\" rx=\"4\" fill=\"#f97316\"/><rect x=\"198\" y=\"90\" width=\"8\" height=\"140\" fill=\"#374151\"/><rect x=\"170\" y=\"225\" width=\"64\" height=\"10\" rx=\"4\" fill=\"#4b5563\"/><line x1=\"230\" y1=\"100\" x2=\"340\" y2=\"100\" stroke=\"#374151\" stroke-width=\"6\" stroke-linecap=\"round\"/><path d=\"M225 170 L260 170 L242 110 Z\" fill=\"#c4b5fd\"/><path d=\"M310 170 L345 170 L327 110 Z\" fill=\"#c4b5fd\"/><circle cx=\"242\" cy=\"158\" r=\"9\" fill=\"#f59e0b\"/><circle cx=\"327\" cy=\"158\" r=\"9\" fill=\"#f59e0b\"/></svg>",
  "foto_descripcion": "Ícono plano de una persona mayor de camisa violeta con una libreta naranja, junto a una balanza gris con una moneda dorada en cada plato, sobre fondo lila claro.",
  "paleta_usada": [
    "#374151",
    "#4b5563",
    "#7c3aed",
    "#c4b5fd",
    "#ede9fe",
    "#f59e0b",
    "#f97316",
    "#fde68a"
  ],
  "viewBox": "0 0 400 300",
  "bytes": 845,
  "meta": {
    "agente": "ilustrador",
    "modelo": "claude-sonnet-5-5",
    "version_prompt": "1.0",
    "fecha": "2026-10-20T23:20:14+00:00",
    "costo_usd": 0.008104,
    "intentos_reparacion": 0
  }
}
