{
  "tarea_id": "2026-10-anticipo-renta-vitalicia-v5",
  "svg": "<svg xmlns=\"http://www.w3.org/2000/svg\" viewBox=\"0 0 400 300\" width=\"400\" height=\"300\"><title>Persona mayor con libreta y balanza con monedas</title><rect x=\"0\" y=\"0\" width=\"400\" height=\"300\" fill=\"#ede9fe\"/><circle cx=\"110\" cy=\"100\" r=\"30\" fill=\"#fde68a\"/><path d=\"M70 230 L70 170 Q110 140 150 170 L150 230 Z\" fill=\"#7c3aed\"/><rect x=\"120\" y=\"185\" width=\"40\" height=\"30\" rx=\"4\" fill=\"#f97316\"/><path d=\"M82 80 Q110 55 138 80 Z\" fill=\"#9ca3af\"/><rect x=\"268\" y=\"110\" width=\"8\" height=\"120\" fill=\"#374151\"/><rect x=\"240\" y=\"226\" width=\"64\" height=\"10\" rx=\"4\" fill=\"#4b5563\"/><line x1=\"220\" y1=\"115\" x2=\"324\" y2=\"115\" stroke=\"#374151\" stroke-width=\"6\" stroke-linecap=\"round\"/><path d=\"M200 175 Q222 200 244 175 Z\" fill=\"#6d28d9\"/><path d=\"M300 175 Q322 200 344 175 Z\" fill=\"#6d28d9\"/><circle cx=\"222\" cy=\"165\" r=\"9\" fill=\"#f59e0b\"/><circle cx=\"322\" cy=\"165\" r=\"9\" fill=\"#f59e0b\"/></svg>",
  "foto_descripcion": "Ícono plano de una persona mayor de cabello gris con ropa violeta que sostiene una libreta naranja, junto a una balanza gris con una moneda dorada en cada plato sobre fondo lila.",
  "paleta_usada": [
    "#374151",
    "#4b5563",
    "#6d28d9",
    "#7c3aed",
    "#9ca3af",
    "#ede9fe",
    "#f59e0b",
    "#f97316",
    "#fde68a"
  ],
  "viewBox": "0 0 400 300",
  "bytes": 884,
  "meta": {
    "agente": "ilustrador",
    "modelo": "claude-sonnet-5-5",
    "version_prompt": "1.0",
    "fecha": "2026-10-20T22:07:58+00:00",
    "costo_usd": 0.008406,
    "intentos_reparacion": 0
  }
}
