{
  "tarea_id": "2026-10-que-tan-renida-fue",
  "svg": "<svg xmlns=\"http://www.w3.org/2000/svg\" viewBox=\"0 0 400 300\" width=\"400\" height=\"300\"><title>Urna de votación y dos barras horizontales de colores</title><rect x=\"0\" y=\"0\" width=\"400\" height=\"300\" fill=\"#ede9fe\"/><rect x=\"50\" y=\"120\" width=\"120\" height=\"110\" rx=\"8\" fill=\"#6d28d9\"/><rect x=\"75\" y=\"135\" width=\"70\" height=\"10\" rx=\"5\" fill=\"#1f2937\"/><rect x=\"85\" y=\"80\" width=\"50\" height=\"60\" rx=\"4\" fill=\"#ffffff\" transform=\"rotate(-8 110 110)\"/><rect x=\"210\" y=\"110\" width=\"150\" height=\"34\" rx=\"6\" fill=\"#f97316\"/><rect x=\"210\" y=\"170\" width=\"140\" height=\"34\" rx=\"6\" fill=\"#3b82f6\"/></svg>",
  "foto_descripcion": "Ícono plano de una urna morada con una papeleta blanca asomando y, a su lado, dos barras horizontales de longitud parecida, una naranja y otra azul, sobre un fondo lila claro.",
  "paleta_usada": [
    "#1f2937",
    "#3b82f6",
    "#6d28d9",
    "#ede9fe",
    "#f97316",
    "#ffffff"
  ],
  "viewBox": "0 0 400 300",
  "bytes": 592,
  "meta": {
    "agente": "ilustrador",
    "modelo": "claude-sonnet-5-5",
    "version_prompt": "1.0",
    "fecha": "2026-10-26T19:32:30+00:00",
    "costo_usd": 0.006008,
    "intentos_reparacion": 0
  }
}
