{
  "tarea_id": "2026-10-adelantar-compras-queso-v3",
  "svg": "<svg xmlns=\"http://www.w3.org/2000/svg\" viewBox=\"0 0 400 300\" width=\"400\" height=\"300\"><title>Bodega refrigerada con cajas de queso apiladas y un calendario</title><rect x=\"0\" y=\"0\" width=\"400\" height=\"300\" fill=\"#e0f2fe\"/><rect x=\"40\" y=\"90\" width=\"220\" height=\"160\" fill=\"#ffffff\"/><polygon points=\"30,95 150,45 270,95\" fill=\"#3b82f6\"/><rect x=\"60\" y=\"130\" width=\"90\" height=\"120\" fill=\"#93c5fd\"/><rect x=\"165\" y=\"190\" width=\"40\" height=\"60\" fill=\"#fde68a\"/><rect x=\"205\" y=\"210\" width=\"40\" height=\"40\" fill=\"#f59e0b\"/><rect x=\"175\" y=\"150\" width=\"40\" height=\"40\" fill=\"#f59e0b\"/><rect x=\"290\" y=\"70\" width=\"90\" height=\"100\" rx=\"8\" fill=\"#ffffff\"/><rect x=\"290\" y=\"70\" width=\"90\" height=\"25\" rx=\"8\" fill=\"#ef4444\"/><circle cx=\"335\" cy=\"135\" r=\"18\" fill=\"#f97316\"/><rect x=\"20\" y=\"250\" width=\"360\" height=\"10\" fill=\"#9ca3af\"/></svg>",
  "foto_descripcion": "Ícono plano de una bodega blanca con techo azul y puerta celeste, cajas de queso amarillas y naranjas apiladas, y un calendario blanco con encabezado rojo y un círculo naranja, sobre fondo celeste.",
  "paleta_usada": [
    "#3b82f6",
    "#93c5fd",
    "#9ca3af",
    "#e0f2fe",
    "#ef4444",
    "#f59e0b",
    "#f97316",
    "#fde68a",
    "#ffffff"
  ],
  "viewBox": "0 0 400 300",
  "bytes": 833,
  "meta": {
    "agente": "ilustrador",
    "modelo": "claude-sonnet-5-5",
    "version_prompt": "1.0",
    "fecha": "2026-10-20T22:00:08+00:00",
    "costo_usd": 0.008174,
    "intentos_reparacion": 0
  }
}
